<?xml version="1.0" encoding="UTF-8"?>
<pedidos xmlns:xsi="http://www.w3.org/2001/XMLSchema-instance"
 xsi:noNamespaceSchemaLocation="pedidos.xsd">
    <sucursal codigo="A1234567">
        <direccion></direccion>
        <nom_empleado></nom_empleado>
        <fecha_pedido>2020-02-10</fecha_pedido>
        <observaciones></observaciones>
        <articulos codigo="132-ABC">
            <num_unidades>3</num_unidades>
            <precio_articulos>9</precio_articulos>
            <precio_articulos>2,9</precio_articulos>
            <precio_articulos>6,9</precio_articulos>
            <observaciones>Segunda mano</observaciones>
            <plazo>2020-02-10T12:00:00</plazo>
        </articulos>
    </sucursal>
</pedidos>